uri,url,author_handle,text,created_at,like_count,repost_count,reply_count,quote_count,news_or_opinion_category,is_political,is_self_contained,is_structurally_complete,toxicity_prob,toxicity_tier,political_stance
at://did:plc:5otyxwigslrvse4mqe5ag2ol/app.bsky.feed.post/3mmypntotkc2b,https://bsky.app/profile/doctorrubato.com/post/3mmypntotkc2b,doctorrubato.com,"Us boomers gave Americans civil rights, voting rights, feminism, equal credit for women, Title IX in education, birth control, Roe v Wade, EPA, Clean Air, Clean Water, disability rights, LGBTQ movement, anti-war protests, workplace safety. Oh, plus the best music ever! You're welcome!",2026-05-29 09:10:18.901000-05:00,5,1,2,0,opinion,True,True,True,0.038048524,low,left
at://did:plc:hl665htx3p4kbx6x24b5bgj2/app.bsky.feed.post/3mmypntll2k24,https://bsky.app/profile/bethpdx.bsky.social/post/3mmypntll2k24,bethpdx.bsky.social,"By ""defunding"" the care patients get at Planned Parenthood health centers, lawmakers are denying patients preventive services like birth control, cancer screenings, STI testing and treatment, and more. And when health centers close, entire communities suffer.-from Planned Parenthood",2026-05-29 09:10:18.795000-05:00,1,0,0,0,opinion,True,True,True,0.024731753,low,left
at://did:plc:xjhfhjerurn4wuxxvfc7rpc5/app.bsky.feed.post/3mmypgay4fc22,https://bsky.app/profile/darkprimus.bsky.social/post/3mmypgay4fc22,darkprimus.bsky.social,Why you think Harris running on *restoring* reproductive rights that were just stripped by Dobbs is some kind of massive dunk on someone who is being critical of Dems inability to protect those reproductive rights in the first place?,2026-05-29 09:06:04.402000-05:00,0,0,1,0,opinion,True,True,True,0.12520397,medium,left
at://did:plc:ns6mew63gkgvftflpcl2xx5x/app.bsky.feed.post/3mmyp6dfqsl2k,https://bsky.app/profile/e-stherforcongress.bsky.social/post/3mmyp6dfqsl2k,e-stherforcongress.bsky.social,"Every woman in every state should have safe access to abortion, contraception, and IVF. 

Day 11 of my Policy Priorities Countdown to Election Day: Reproductive Rights & Gender Equality",2026-05-29 09:01:38.370000-05:00,0,0,3,0,opinion,True,True,True,0.03875561,low,left
at://did:plc:ptvepzw6aoqfknexjbn7v2el/app.bsky.feed.post/3mmyp4mxszl2x,https://bsky.app/profile/thepowerbroker.bsky.social/post/3mmyp4mxszl2x,thepowerbroker.bsky.social,"Sorry, could you hold off flitting between moronic buzzphrases for a moment and stick to the point?

Did Kamala Harris make reproductive rights a massive part of her 2024 campaign? Yes or no?",2026-05-29 09:00:41.428000-05:00,0,0,1,0,opinion,True,True,True,0.43965456,medium,unclear
at://did:plc:kpcgjjfuvvj7jdn6dpsy73eq/app.bsky.feed.post/3mmyp3ffre22c,https://bsky.app/profile/mrfl14.bsky.social/post/3mmyp3ffre22c,mrfl14.bsky.social,Killing the mother to prevent her from having an abortion?  Wouldn’t that be double homicide by pro-life standards?,2026-05-29 08:59:59.945000-05:00,0,0,0,0,opinion,True,True,True,0.37751234,medium,unclear
at://did:plc:6cuhyh72wwthjmwrcnob5b62/app.bsky.feed.post/3mmyokpac5c2h,https://bsky.app/profile/okty.bsky.social/post/3mmyokpac5c2h,okty.bsky.social,"For one million dollars I will perform Something Corporate's ""Konstantine"" on stage at Freedom 250 Facism Extravaganza ending my one song set by lighting my piano on fire and donating my entire fee to Planned Parenthood",2026-05-29 08:50:39.824000-05:00,4,0,0,0,opinion,True,True,True,0.19893374,medium,left
at://did:plc:mwkuptzfe3lok6ffriscmmhy/app.bsky.feed.post/3mmyoavj66s2u,https://bsky.app/profile/quilterace.bsky.social/post/3mmyoavj66s2u,quilterace.bsky.social,"It’s truly amazing to watch. And as soon as a Dem is president they will revert back to their “ family values, pro life, fiscal conservative “ BIT. And Fox will spin the the outrage for them.",2026-05-29 08:45:10.863000-05:00,2,0,0,0,opinion,True,True,True,0.07845957,low,unclear
at://did:plc:ptvepzw6aoqfknexjbn7v2el/app.bsky.feed.post/3mmymvnbl7c2x,https://bsky.app/profile/thepowerbroker.bsky.social/post/3mmymvnbl7c2x,thepowerbroker.bsky.social,And what other things are you talking about here? I guess increasing healthcare coverage isn't good? Raising the minimum wage isn't good? Consumer protections and workers rights aren't good? Reproductive rights aren't good? Education spending isn't good?,2026-05-29 08:20:57.414000-05:00,0,0,1,1,opinion,True,True,True,0.03781283,low,unclear
at://did:plc:2melr6mzubhzqajoduym7eeq/app.bsky.feed.post/3mmyzsfkz5k22,https://bsky.app/profile/ackbar7.bsky.social/post/3mmyzsfkz5k22,ackbar7.bsky.social,Abortion rights were lost with Democrats in control of the president and Congress. Obama codified the Bush tax cuts and Biden didn't even mention repealing the Trump ones. Democrats have been terrible on immigration since Clinton. Dems are now attempting to throw team people under the bus.,2026-05-29 12:11:49.286000-05:00,1,0,4,0,opinion,True,True,True,0.147767,medium,right
at://did:plc:25towud5ixs5i6x6rnn7qmw3/app.bsky.feed.post/3mmyw6bmhhc2m,https://bsky.app/profile/globalabortionnews.bsky.social/post/3mmyw6bmhhc2m,globalabortionnews.bsky.social,"“Malawi’s restrictive abortion laws are forcing girls and young women into unsafe abortions,” said Misheck Gondwe of the Malawi Sexual Reproductive Health and Rights Alliance. To address the crisis, the alliance is calling for legal reforms, access to contraception and expanded sexuality education.",2026-05-29 11:06:52.825000-05:00,24,5,1,1,opinion,True,True,True,0.041915078,low,left
at://did:plc:e4hhpvt2ozbklfcqcc7pce6o/app.bsky.feed.post/3mmyw4mulqc2r,https://bsky.app/profile/emily1collins.bsky.social/post/3mmyw4mulqc2r,emily1collins.bsky.social,Give up your sexual boundaries and I'll give you your abortion rights. Give up the word “woman” and I'll stop imposing sex-role stereotypes on you.,2026-05-29 11:05:57.518000-05:00,4,2,1,0,opinion,True,True,True,0.45090583,medium,unclear
at://did:plc:qgimsdoqyxdklecbembcwvc5/app.bsky.feed.post/3mmyvmp3uvk2w,https://bsky.app/profile/margaretforsyth.bsky.social/post/3mmyvmp3uvk2w,margaretforsyth.bsky.social,"I'm not so sure--federal protection for LGBTQ & abortion rights--but, yes, one of his strengths IS identifying how our policies diminish everybody's material well-being. He's such a clear progressive though, & people are trying to call him a Republican plant, so please be careful how you say this.",2026-05-29 10:57:02.983000-05:00,0,0,1,0,opinion,True,True,True,0.085582085,low,left
at://did:plc:66xhjlkx4fhuyvotrieiztbm/app.bsky.feed.post/3mmyt4fy6ic2t,https://bsky.app/profile/thebunnyamendt.bsky.social/post/3mmyt4fy6ic2t,thebunnyamendt.bsky.social,"Republicans choose a Leader that hates the party that supports Democracy, Reparations for the genocide of Native Americans and for the slavery of Africans, Medicare for All, an Economic Bill of Rights, Asylum Rights, the LGBTQIA Community and abortion rights for women.",2026-05-29 10:12:09.069000-05:00,2,0,0,0,opinion,True,True,True,0.28674445,medium,left
at://did:plc:sfsowlsdggzs2wz5vvhelylf/app.bsky.feed.post/3mmyoot6dmc2z,https://bsky.app/profile/alybensmi.bsky.social/post/3mmyoot6dmc2z,alybensmi.bsky.social,Came here to say this lol. Where’s our expanded medicaid? Our abortion access? A bunch of sociopaths in Jeff City said “nah I don’t think so”,2026-05-29 08:52:58.173000-05:00,7,0,0,0,opinion,True,True,True,0.4269174,medium,left
at://did:plc:ytvcng5tektt3zrqlxtjhtep/app.bsky.feed.post/3mmy2cj6mss2q,https://bsky.app/profile/toruokada69.bsky.social/post/3mmy2cj6mss2q,toruokada69.bsky.social,"Shouldn't the question rather be ""And how exactly does this #NFL knowledge help a senator decide whether a 500-page bill about #AI data centers, #abortion rights, or billionaire taxation should pass or not?"" instead of swallowing the bait?",2026-05-29 02:48:10.198000-05:00,0,0,0,0,opinion,True,True,True,0.057005897,low,unclear
at://did:plc:onosb7hressea4vw5yyiajsk/app.bsky.feed.post/3mmy2aml7c22f,https://bsky.app/profile/officiallilsilver.bsky.social/post/3mmy2aml7c22f,officiallilsilver.bsky.social,"As a member of Congress with a 100% voting record on choice, I will always fight for access to abortion and reproductive health care nationwide.

Fighting the Opioid Crisis in Northwest Washington

This month, I co-introduced the End Fentanyl Trafficking with Local Task Forces Act.",2026-05-29 02:47:06.657000-05:00,0,0,0,0,opinion,True,True,True,0.022139108,low,left
at://did:plc:7m4mxuours4cjhrm5exausy5/app.bsky.feed.post/3mmxvq2s7ic2e,https://bsky.app/profile/klodovik.bsky.social/post/3mmxvq2s7ic2e,klodovik.bsky.social,I was horrified by the sneaky abortion ban - it is not illegal but state owned hospitals are not performing it!,2026-05-29 01:26:16.167000-05:00,6,1,1,0,opinion,True,True,True,0.17025198,medium,left
at://did:plc:mb74medxp5ft5aha4noes2h4/app.bsky.feed.post/3mmxo7sua7s2r,https://bsky.app/profile/hazelcakes.bsky.social/post/3mmxo7sua7s2r,hazelcakes.bsky.social,"i think repubs would launch some super goofy racist truther committee, and dems would sacrifice trans rights and abortion rights, and you all would say “the mid-terms are the most important election in our lives, guys!”

and then dems would lose again and you’d be back with these scold posts",2026-05-28 23:11:54.777000-05:00,9,0,1,0,opinion,True,True,True,0.39021665,medium,unclear
at://did:plc:afj3o7yatzf64x5gekjalbad/app.bsky.feed.post/3mmxken3yts2k,https://bsky.app/profile/srslymagenta.bsky.social/post/3mmxken3yts2k,srslymagenta.bsky.social,"The logical conclusion to this is, ""and because I'm not their doctor, nor their geneticist, and because it's not my damn business, let's just leave all trans individuals alone to their own business."" 

It's just so simple-- Democrats should understand from protecting abortion rights. But, no.",2026-05-28 22:03:01.555000-05:00,2,0,0,0,opinion,True,True,True,0.49139655,medium,left
at://did:plc:st535ku3pt3iqhksgcwtvfvq/app.bsky.feed.post/3mmx7tu2lic2g,https://bsky.app/profile/kerravon.bsky.social/post/3mmx7tu2lic2g,kerravon.bsky.social,"Just like I'm certain Hillary Clinton would have appointed a SCOTUS majority that preserved abortion rights and the VRA, if butthurt leftists had simply swallowed their fucking pride.",2026-05-28 18:54:41.006000-05:00,0,0,0,0,opinion,True,True,True,0.6989911,medium,left
at://did:plc:de2b26mcnrp3uc7zxg7enx7o/app.bsky.feed.post/3mmx5x4xmwc2g,https://bsky.app/profile/malted1.bsky.social/post/3mmx5x4xmwc2g,malted1.bsky.social,"Maybe American women are tired of being second class citizens.  Mexico, with such a large Catholic population, ensures abortion rights and has a female president.  The US has rejected 2 highly qualified women in favor of a rapist and legislates women’s bodies.",2026-05-28 18:20:43.526000-05:00,32,5,1,0,opinion,True,True,True,0.38601747,medium,left
at://did:plc:tzj3f7pdfqbhmnwqcfaldmcv/app.bsky.feed.post/3mmx4fp6mrs2d,https://bsky.app/profile/thedarkestbard.bsky.social/post/3mmx4fp6mrs2d,thedarkestbard.bsky.social,"Genuine question: how does ""anti abortion"" fit in the INCEL ideology? Last I checked, and I speak with authority because I used to be one, Incel Ideology has nothing to do with fetal personhood or abortion rights - right? So why are you calling them Incels?",2026-05-28 17:53:04.906000-05:00,0,0,0,0,opinion,True,True,True,0.16245349,medium,unclear
at://did:plc:mwuefy4n3swcxw5dzeeeufg4/app.bsky.feed.post/3mmx34krktc2f,https://bsky.app/profile/crankygrandma55.bsky.social/post/3mmx34krktc2f,crankygrandma55.bsky.social,Message to young voters. Why did we olds fight for women's rights. Trans rights. Gay rights. No nukes. Bodily Autonomy. Abortion rights. Freedom of speech. No wars. BECAUSE WE HAVE LIVED EXPERIENCE OF WHAT IT WAS LIKE WITHOUT THESE THINGS.,2026-05-28 17:30:04.554000-05:00,5,0,1,0,opinion,True,True,True,0.15656179,medium,left
at://did:plc:icdtlkkcasrca7fax7vvq5po/app.bsky.feed.post/3mmwv3b2ttk2e,https://bsky.app/profile/qupid.bsky.social/post/3mmwv3b2ttk2e,qupid.bsky.social,"I hate when terfs bring up reproductive health and discrimination against women as reasons we ""need to acknowledge the difference between cis and trans women"" trans women have never got in the way of my reproductive rights. Literally never. You're literally playing dumb",2026-05-28 15:41:58.366000-05:00,0,0,1,0,opinion,True,True,True,0.6289369,medium,left
at://did:plc:qgv3qtybvsl3jfmgi453vgbc/app.bsky.feed.post/3mmwuze7ifs2w,https://bsky.app/profile/peoplesworld1924.bsky.social/post/3mmwuze7ifs2w,peoplesworld1924.bsky.social,"Disregarding womens’ health, Arkansas abortion ban pushes mothers to death’s door. Emily Waldorf faced a life-threatening miscarriage. But fearing Arkansas’ anti-abortion law, hospital lawyers refused to authorize care.
#health #politics",2026-05-28 15:40:54.555000-05:00,6,0,0,0,opinion,True,True,True,0.08716487,low,left
at://did:plc:g53qeu4ccuticcil7hoqd4il/app.bsky.feed.post/3mmwuf3he6s24,https://bsky.app/profile/mt4congress.bsky.social/post/3mmwuf3he6s24,mt4congress.bsky.social,I am proud to stand shoulder to shoulder with Planned Parenthood Action Fund in the fight to protect reproductive health and I am honored to earn their endorsement!,2026-05-28 15:29:34.286000-05:00,0,0,0,0,opinion,True,True,True,0.012000589,low,left
at://did:plc:df6hugxknby3dd6ste553aex/app.bsky.feed.post/3mmwsjcimoy2u,https://bsky.app/profile/davidgarcias15.bsky.social/post/3mmwsjcimoy2u,davidgarcias15.bsky.social,"Empowering Choices: The Impact of Reproductive Health Scans on Family Planning

The journey of family planning is deeply personal, influenced by cultural beliefs, health concerns, and personal aspirations. The advent of reproductive health scans has revolutionized how individuals and couples…",2026-05-28 14:56:06-05:00,0,0,0,0,opinion,True,True,True,0.015581916,low,neutral
at://did:plc:75dopidsrwpadtzolnpe5g4g/app.bsky.feed.post/3mmwqboeqlv2g,https://bsky.app/profile/ncmegaphone.bsky.social/post/3mmwqboeqlv2g,ncmegaphone.bsky.social,"Abortion access is healthcare. Everyone deserves the freedom to make decisions about their own body, future, and family without barriers and fear. #ncpol #nc
#abortionrights #reproductiverights",2026-05-28 14:16:04.825052-05:00,0,0,0,0,opinion,True,True,True,0.027560094,low,left
at://did:plc:54blq35yjjlsprwhyfzmhp56/app.bsky.feed.post/3mmwnwvb5fs2y,https://bsky.app/profile/davallone.bsky.social/post/3mmwnwvb5fs2y,davallone.bsky.social,"Schmidt is the absolute worst of them. He is 100% Republican. The guy who pushed McCain to run on a national abortion ban wanted to lecture lifelong pro choice advocates about how to protect women's rights. Fuck that guy, sideways, with a cactus.",2026-05-28 13:34:15.580000-05:00,3,0,1,0,opinion,True,True,True,0.7701451,high,left
at://did:plc:vgecb4gqqyz2yhegu5cu73dj/app.bsky.feed.post/3mmwnvhaobc2c,https://bsky.app/profile/jenncornell.bsky.social/post/3mmwnvhaobc2c,jenncornell.bsky.social,"Humbled to have earned this endorsement from Planned Parenthood as a Sexual & Reproductive Health Champion, which recognizes a complete alignment with their mission and the values I promote in my role on #a2council. I will always fight for equity when it comes to healthcare.",2026-05-28 13:33:27.319000-05:00,19,0,0,0,opinion,True,True,True,0.037105743,low,left
at://did:plc:wknnk4h7rdluxzgpzygfjwrd/app.bsky.feed.post/3mmwmbblwk22d,https://bsky.app/profile/bullwark.bsky.social/post/3mmwmbblwk22d,bullwark.bsky.social,"Joe Biden gave all the covid emergency money to cops, oversaw the loss of abortion rights, tried college students as terrorists and helped kill hundreds of thousands of people. But he liked ice cream and had $250,000+ in dental work and hair plugs so it wasn't fascism.",2026-05-28 13:04:16.576000-05:00,63,8,5,0,opinion,True,True,True,0.30854854,medium,right
at://did:plc:s7v5f35fc72k7jq4lfjntwhh/app.bsky.feed.post/3mmwm5qeq5s2c,https://bsky.app/profile/gamer47.bsky.social/post/3mmwm5qeq5s2c,gamer47.bsky.social,I can't vote for a Christian who attempts to frame abortion rights as consistent with Christian scripture and faith.,2026-05-28 13:02:17.852000-05:00,0,0,7,0,opinion,True,True,True,0.30527395,medium,left
at://did:plc:i4tgn42sadgvr3hkslicvpjs/app.bsky.feed.post/3mmz6vohdes2x,https://bsky.app/profile/oldtimeham.bsky.social/post/3mmz6vohdes2x,oldtimeham.bsky.social,"Republican Justice Alito
dealt women's rights a rude veto.
His awful decree
so offends you and me,
that he now moves about incognito.",2026-05-29 13:43:07.975000-05:00,0,0,0,0,opinion,True,True,True,0.27412915,medium,left
at://did:plc:l5frbcjkce3qevn46zgjkzxm/app.bsky.feed.post/3mmz5eioels2r,https://bsky.app/profile/heymickie42.bsky.social/post/3mmz5eioels2r,heymickie42.bsky.social,"Trans women are supportive of women's rights/spaces because we ARE women. And the Democratic Party, as a whole, sure does act like there are no consequences. Very few dem pols can speak about us or our issues with anything like informed clarity or compassion 
They act like we're a nuisance instead",2026-05-29 13:15:37.747000-05:00,1,0,1,0,opinion,True,True,True,0.29771072,medium,left
at://did:plc:ttmxxh26a6xgbfl4e7ub3imf/app.bsky.feed.post/3mmz4skmcsc2k,https://bsky.app/profile/gmcclurg17.bsky.social/post/3mmz4skmcsc2k,gmcclurg17.bsky.social,"I disagree, there aren't any political consequences to trans exclusion/elimination...

But there is... Trans community has had a long history of being supportive of women's rights/spaces and changing/advancing our society towards social equality. Without their future support the Dems is f**ked. js",2026-05-29 13:05:35.798000-05:00,0,0,1,0,opinion,True,True,True,0.47886392,medium,right
at://did:plc:aiz2o3hhpuwzv54rpbywqu2y/app.bsky.feed.post/3mmz4a5jsy22k,https://bsky.app/profile/mtbotany.bsky.social/post/3mmz4a5jsy22k,mtbotany.bsky.social,"Trans rights are women's rights.

If trans women are not free to exist then cis women are also not free, because this cudgel can be turned on them the moment anyone is offended by anything they do.",2026-05-29 12:55:18.104000-05:00,2,1,1,0,opinion,True,True,True,0.29953843,medium,left
at://did:plc:3hkvjk3s7etvwhpqxbeb6trk/app.bsky.feed.post/3mmz2dirf6k2t,https://bsky.app/profile/russiaownsmaga.bsky.social/post/3mmz2dirf6k2t,russiaownsmaga.bsky.social,"Poor widdle Johnny all hurt and depressed. Remember that had he won he'd still be pushing GOP BS down everyone's throat, tearing at women's rights, voter rights.

He's not the frog. He's the scorpion and all of America is the frog.

He's a derpy little chud.

Let the GOP eat each other alive",2026-05-29 12:21:23.067000-05:00,0,0,0,0,opinion,True,True,True,0.44002727,medium,left
at://did:plc:z4azwfwdyessd4xpcw2wsiin/app.bsky.feed.post/3mmyzoknj3c2y,https://bsky.app/profile/altdivide.bsky.social/post/3mmyzoknj3c2y,altdivide.bsky.social,You have said nothing about women’s rights and autonomy which have been under threat by trump. Will California support women under your leadership? Serious replies only.,2026-05-29 12:09:40.394000-05:00,1,0,3,0,opinion,True,True,True,0.102192536,medium,left
at://did:plc:eq5x2rk6bzp4esklll6wwwka/app.bsky.feed.post/3mmyxlyq6vk2j,https://bsky.app/profile/generalstreet.bsky.social/post/3mmyxlyq6vk2j,generalstreet.bsky.social,Never understood American obsession about abuse of women in foreign countries when they are busy turning into the Taliban on women’s rights,2026-05-29 11:32:27.015000-05:00,1,0,1,0,opinion,True,True,True,0.28547668,medium,unclear
at://did:plc:goqh2c3wbkm5ff3swd2y4vtx/app.bsky.feed.post/3mmywisz7kc22,https://bsky.app/profile/resistor2025bull.bsky.social/post/3mmywisz7kc22,resistor2025bull.bsky.social,"Oh no, they won't spend their own money. Oligarchs are the whiniest welfare queens 👸 of all. 

I'd rather see my tax dollars go to equal/women's rights, the unhoused, veterans, and children. Let's throw in Medicaid for all, and then fight climate degradation. Hooray for planet earth 🌏!",2026-05-29 11:12:46.614000-05:00,3,0,1,0,opinion,True,True,True,0.25462922,medium,left
at://did:plc:eej4ojwagi3xfdux5frlxzo2/app.bsky.feed.post/3mmyv45s53k2d,https://bsky.app/profile/judyz84.bsky.social/post/3mmyv45s53k2d,judyz84.bsky.social,"Do republican lawmakers have nothing else to do but up the attacks on women's rights?  ""In North Carolina they have introduced one the most abominable, dangerous, & downright disgusting bills in history of the state, classifying abortion as first-degree murder and thus punishable by death.""",2026-05-29 10:47:47.966000-05:00,1,0,0,0,opinion,True,True,True,0.39441586,medium,left
at://did:plc:y2sxmjqjfshio4rw4wfrg7td/app.bsky.feed.post/3mmysg7dt3c2a,https://bsky.app/profile/rafaaaa123.bsky.social/post/3mmysg7dt3c2a,rafaaaa123.bsky.social,"12/12
The women’s rights movement of the 1920s left an important legacy that still impacts society today. The right to vote became one of the greatest achievements for women and inspired future generations to continue fighting for equality and civil rights.",2026-05-29 09:59:23.704000-05:00,0,0,0,0,opinion,True,True,True,0.01017851,low,left
at://did:plc:eqynp52b6yfxo6t2wgqridwg/app.bsky.feed.post/3mmyrvznzmc2f,https://bsky.app/profile/bartfree.bsky.social/post/3mmyrvznzmc2f,bartfree.bsky.social,"Maga leader Pete Hegseth wrote the 2020 election was about America versus “ the Left.”    Maga has separated themselves from mainstream America , defining  integration, women’s rights & public benefits as “the left.” Below, a Maga extremist attacks an American  as a “lefty” for not being Maga.",2026-05-29 09:50:41.081000-05:00,0,0,0,0,opinion,True,True,True,0.075294,low,left
at://did:plc:lrr632kvugzfk2vsghjytvgl/app.bsky.feed.post/3mmyq6k3xus2e,https://bsky.app/profile/nyclu.org/post/3mmyq6k3xus2e,nyclu.org,"This is why we're fighting for universal child care: because all of us deserve access to child care regardless of employment, income, disability, geography, or immigration status.",2026-05-29 09:19:11.255000-05:00,0,0,0,0,opinion,True,True,True,0.020960633,low,left
at://did:plc:ba4ljetiaeiu5vrpfhymga7a/app.bsky.feed.post/3mmypbnwkbc26,https://bsky.app/profile/silicology.bsky.social/post/3mmypbnwkbc26,silicology.bsky.social,"History shows that major shifts — abolition movements, women’s rights, labor rights, environmental awareness, open-source software, public health systems — often took decades of sustained coordination and repeated effort before becoming mainstream.",2026-05-29 09:03:30.191000-05:00,1,0,1,0,opinion,True,True,True,0.004775103,low,neutral
at://did:plc:bjdjomgx7t7f3agie7ndvosb/app.bsky.feed.post/3mmylgbnm6k2p,https://bsky.app/profile/tehsamantha.bsky.social/post/3mmylgbnm6k2p,tehsamantha.bsky.social,"It's used after they've exhausted all the slurs for trans people to say ""how dare you question our use of slurs? Don't you know this is about WOMEN'S RIGHTS!?""",2026-05-29 07:54:30.028000-05:00,1,0,1,0,opinion,True,True,True,0.31132057,medium,unclear
at://did:plc:bjdjomgx7t7f3agie7ndvosb/app.bsky.feed.post/3mmyl57aicc2a,https://bsky.app/profile/tehsamantha.bsky.social/post/3mmyl57aicc2a,tehsamantha.bsky.social,"This may seem a petty point but language is important and revealing. We're constantly emphasised in the media as a sideshow for people to look at and debate. Yet we can't call that out because this is actually about ""women's rights""

Yet ""women's rights"" is only ever used in a reactionary way",2026-05-29 07:49:25.619000-05:00,2,0,1,0,opinion,True,True,True,0.05750068,low,left
at://did:plc:bjdjomgx7t7f3agie7ndvosb/app.bsky.feed.post/3mmyl57aefc2a,https://bsky.app/profile/tehsamantha.bsky.social/post/3mmyl57aefc2a,tehsamantha.bsky.social,"Trans rights are apparently such a problem with women's rights we still only call it the ""trans debate"" or ""trans issues"" or ""trans row"". It's never called the ""women's debate"" because it's entirely about debating and restricting trans people",2026-05-29 07:49:25.618000-05:00,3,0,1,0,opinion,True,True,True,0.31963667,medium,left
at://did:plc:7jzcvltv54nymu3esx3n5wxq/app.bsky.feed.post/3mmyksgmpms2w,https://bsky.app/profile/thinkingcc.bsky.social/post/3mmyksgmpms2w,thinkingcc.bsky.social,"You mean, you oppose a war against an oppressive group that has killed far more Iranians while crushing dissent? Those who obliterate women’s rights? You can’t get any more anti-democratic than the IRGC…",2026-05-29 07:43:24.264000-05:00,0,0,0,0,opinion,True,True,True,0.2855005,medium,left
at://did:plc:jpw3yieqid6tcywrp7yfguol/app.bsky.feed.post/3mmykh7cp422b,https://bsky.app/profile/eastsplaining.bsky.social/post/3mmykh7cp422b,eastsplaining.bsky.social,"The part where it was mostly empty promises. ""Women's rights"" in Soviet Union were as real as Donald Trump's ""lowering prices"".",2026-05-29 07:37:07.497000-05:00,0,0,0,0,opinion,True,True,True,0.07608539,low,unclear
at://did:plc:ndpimx6b354av7omhvflkqpb/app.bsky.feed.post/3mmyk2nfv7c2w,https://bsky.app/profile/lmnash123.bsky.social/post/3mmyk2nfv7c2w,lmnash123.bsky.social,"You are not anti-war.

Whether you are genuinely socialist, I can't say.

You certainly aren't anti-imperialist, nor anti-colonialist.  

Nor do you believe and defend human rights, especially indigenous rights, women's rights, and LGBTQ rights. Not for non Americans, anyway.",2026-05-29 07:30:06.065000-05:00,1,0,0,0,opinion,True,True,True,0.1460314,medium,unclear
at://did:plc:zhbhwsqkcvnmetkjfjn2hqmx/app.bsky.feed.post/3mmyj5mdoyk25,https://bsky.app/profile/biologically.bsky.social/post/3mmyj5mdoyk25,biologically.bsky.social,"Transwomen wanting to enter a women-only sport, or safe space, toilet, changing room etc have the burden, the onus, to persuade us all by argument to change the hard-fought situation of creating & enforcing women's rights legislation. It's not for us to present ANY argument!",2026-05-29 07:13:51.875000-05:00,0,0,0,0,opinion,True,True,True,0.23523538,medium,right
