uri,url,author_handle,text,created_at,like_count,repost_count,reply_count,quote_count,news_or_opinion_category,is_political,is_self_contained,is_structurally_complete,toxicity_prob,toxicity_tier,political_stance
at://did:plc:e6byc4dg6hnphwb27k6wyoey/app.bsky.feed.post/3mmz3bwcy7s2l,https://bsky.app/profile/anarchymarshmallow.bsky.social/post/3mmz3bwcy7s2l,anarchymarshmallow.bsky.social,"Nazis are so damn stupid. If they didn't want ""mass migration"" then the climate crisis and exploitation of the global south are the big factors that drive it, they could've focused on that. But no, they just WANT an underclass of scapegoat to exercise cruelty on. It's their favorite thing.",2026-05-29 12:38:23.907000-05:00,1,0,0,0,opinion,True,True,True,0.8403191,high,left
at://did:plc:jbvsndf2fyb6nocmjt3kaycn/app.bsky.feed.post/3mmz35lfhf22m,https://bsky.app/profile/grayranger.bsky.social/post/3mmz35lfhf22m,grayranger.bsky.social,"Many have said it, but it feels like such a cruel joke that just as we started to figure out how to make progress on climate change suddenly a new industry showed up that consumes colossal amounts of energy and emits titanic amounts of heat.",2026-05-29 12:35:58.237000-05:00,0,0,0,0,opinion,True,True,True,0.024731753,low,left
at://did:plc:auosi5l2g76gykunujwg3cga/app.bsky.feed.post/3mmz33bdemc2n,https://bsky.app/profile/yellowdotstudios.bsky.social/post/3mmz33bdemc2n,yellowdotstudios.bsky.social,"Pew: Only 48% of Americans ""believe"" the scientific FACT that climate change is caused by human activity—a decline since 2019 & 2022 (as climate impacts have increased.) 

This is a massive indictment of news media, elected leaders, and the tech giants that facilitate the spread of disinformation.",2026-05-29 12:34:40.572000-05:00,27,12,4,2,opinion,True,True,True,0.04315203,low,left
at://did:plc:shau7hloektsscw4q6vahuhh/app.bsky.feed.post/3mmz32spiwk2f,https://bsky.app/profile/thehorrorguru.bsky.social/post/3mmz32spiwk2f,thehorrorguru.bsky.social,"Every news program that brought on ""experts"" to ""debate"" the overwhelming scientific consensus on climate change are 100% at fault for people's inability to accept our climate change reality.",2026-05-29 12:34:25.243000-05:00,2,0,1,0,opinion,True,True,True,0.04785245,low,left
at://did:plc:25oecrgr4ngsun2anwerxq23/app.bsky.feed.post/3mmz7qnql6s26,https://bsky.app/profile/catsatira.bsky.social/post/3mmz7qnql6s26,catsatira.bsky.social,"One problem is that they may have underestimated the actual effect of warming from greenhouse gases. It was in part masked by other types of pollution, which have a cooling effect.",2026-05-29 13:58:13.199000-05:00,0,0,0,0,opinion,True,True,True,0.01017851,low,neutral
at://did:plc:eeqygiigi4r4zw2vqfndpbvv/app.bsky.feed.post/3mmz7776pd22t,https://bsky.app/profile/carlmarxman.northsky.social/post/3mmz7776pd22t,carlmarxman.northsky.social,"Keep the promise about pharmacare, put the carbon tax back, implement a wealth tax or two, adequately fund the disability benefit so the disabled don't live in poverty, invest in renewable energy instead of oil and gas, disentangle our military from the USA...

That's an easy start.",2026-05-29 13:48:27.508000-05:00,0,0,0,0,opinion,True,True,True,0.034277402,low,left
at://did:plc:zq46h5uvohvv6qjq6esvcbms/app.bsky.feed.post/3mmz6mp5vwc2t,https://bsky.app/profile/c-anemone-d.bsky.social/post/3mmz6mp5vwc2t,c-anemone-d.bsky.social,"THIS— The reason is that a massively corrupt oligarchy controls the media and the education system.

In almost every country on earth, ending planet-wide self destruction is the one point people from almost every ideological camp agree on. Most only still used fossil fuels cause the US forced them.",2026-05-29 13:38:06.725000-05:00,0,0,0,0,opinion,True,True,True,0.20102765,medium,unclear
at://did:plc:izgy2dfct56fjfzmssegkekq/app.bsky.feed.post/3mmz6m2nqu22q,https://bsky.app/profile/runonclimate.bsky.social/post/3mmz6m2nqu22q,runonclimate.bsky.social,"Denver is powering the city with… sewage? ⚡️

A new (and shocking) thermal energy plan, decarbonizing electricity with waste water. 

You could say that their local government is on a roll 🧻😂 to reduce carbon emissions! 
#denver #localaction",2026-05-29 13:37:45.225000-05:00,0,0,0,0,opinion,True,True,True,0.04760506,low,left
at://did:plc:f4jrwxkdtfjp2hqhmwnf3su7/app.bsky.feed.post/3mmz6hnfyzc2q,https://bsky.app/profile/bernardoverda.bsky.social/post/3mmz6hnfyzc2q,bernardoverda.bsky.social,"Yes. When early climate scientists started figuring out climate, the question was when would the next ice age be, and how much fossil fuels might postpone that.

But we've dumped so much fossil carbon into the system, the next ice age has been cancelled, and we're worried about extreme heat instead.",2026-05-29 13:35:17.122000-05:00,0,0,0,0,opinion,True,True,True,0.010743983,low,left
at://did:plc:pgyjupi7rqmzaq4bqy565wxq/app.bsky.feed.post/3mmz5cubz2222,https://bsky.app/profile/andreisterescu.bsky.social/post/3mmz5cubz2222,andreisterescu.bsky.social,12/ Countries that are more heavily exposed to transition risks generally show lower support for climate neutrality and for shifting subsidies away from fossil fuels. Support for decarbonisation tends to be weakest where the adjustment pressures of the transition are expected to be greatest.,2026-05-29 13:14:40.931000-05:00,0,0,1,0,opinion,True,True,True,0.0077281278,low,neutral
at://did:plc:f66ovrmanp3uygqre2eicwst/app.bsky.feed.post/3mmz56qdlu225,https://bsky.app/profile/johntopham.bsky.social/post/3mmz56qdlu225,johntopham.bsky.social,"Some of these will also lend themselves to grid storage, and finally put renewables on a path to completely replacing fossil fuels as the dominant energy source",2026-05-29 13:12:24.456000-05:00,0,0,0,0,opinion,True,True,True,0.00804228,low,left
at://did:plc:qjtnvrgadxgrppqmatfbilev/app.bsky.feed.post/3mmz4tdxwl72b,https://bsky.app/profile/jdpoc.bsky.social/post/3mmz4tdxwl72b,jdpoc.bsky.social,"Reliable renewable energy and storage? If the government aren’t going to do it, then the people will. This community scheme looks like it will be successful.",2026-05-29 13:06:02.386000-05:00,0,0,0,0,opinion,True,True,True,0.009675868,low,left
at://did:plc:753bbhp6m3m7v24m6ypde3rn/app.bsky.feed.post/3mmz4gsucfa2o,https://bsky.app/profile/h4tp.bsky.social/post/3mmz4gsucfa2o,h4tp.bsky.social,"Most countries drastically increase their use of coal and other fossil fuels when industrializing. India seems to be taking a different path, running their dramatic economic growth mostly on renewables, especially solar. They will be the first major country to industrialize this way. #goodnews",2026-05-29 12:59:00.490000-05:00,7,1,0,0,opinion,True,True,True,0.0154562555,low,left
at://did:plc:yjqekodgo25hjem4isderwak/app.bsky.feed.post/3mmz3yeun3s2q,https://bsky.app/profile/kevinleecaster.bsky.social/post/3mmz3yeun3s2q,kevinleecaster.bsky.social,Ohio just chose to ban new renewable energy projects statewide. It's pretty much become a clear partisan issue in the USA ever since the fossil fuel industry chose to make the Republican Party one of their subsidiaries.,2026-05-29 12:50:57.363000-05:00,0,0,1,0,opinion,True,True,True,0.015393426,low,left
at://did:plc:j2gkbaao7yxeeec4y2atxhj7/app.bsky.feed.post/3mmz3vsv4x223,https://bsky.app/profile/cclimateaction.bsky.social/post/3mmz3vsv4x223,cclimateaction.bsky.social,"Simon Stiell, executive secretary of the U.N.’s climate body reminds us 

“the solutions are just as clear: a faster shift to clean power, which is now cheaper than fossil fuels, and faster to produce, and hence is mission-critical for energy affordability and nations economic security.”",2026-05-29 12:49:31.390000-05:00,2,1,0,0,opinion,True,True,True,0.006785673,low,left
at://did:plc:yjqekodgo25hjem4isderwak/app.bsky.feed.post/3mmz36yuhwk2q,https://bsky.app/profile/kevinleecaster.bsky.social/post/3mmz36yuhwk2q,kevinleecaster.bsky.social,"Perhaps Norway exceeds that, but that is such a small market compared to California they're really not comparable imo.

Plus, the state budget issues in those two states (Norway is a nation state) are vastly different as well in terms of dealing with transitioning their economies off of fossil fuels",2026-05-29 12:36:45.914000-05:00,0,0,1,0,opinion,True,True,True,0.0075710523,low,neutral
at://did:plc:jy7ubxdbebjkh6odfwjctl7p/app.bsky.feed.post/3mmz2z6nejk2q,https://bsky.app/profile/chariselee.bsky.social/post/3mmz2z6nejk2q,chariselee.bsky.social,"America doesn’t care about us or our environment
We barely use green energy at all. They make money off coal & fossil fuels. Proof  that capitalism does not drive innovation & progress. It only drives greed.",2026-05-29 12:33:30.647000-05:00,15,6,3,1,opinion,True,True,True,0.15490346,medium,left
at://did:plc:6c7edzlxccnun75kximgjfad/app.bsky.feed.post/3mmz2czhobs27,https://bsky.app/profile/pascalswager.bsky.social/post/3mmz2czhobs27,pascalswager.bsky.social,"- Destroy all physical evidence of Trump in the WH or DC vicinity
- Raise taxes on rich and corporations 
- Rollback Trump impediments to renewable energy
- Medicare for All
- No increase for Defense until it completes an audit
- Rejoin international agencies",2026-05-29 12:21:07.020000-05:00,7,0,0,0,opinion,True,True,True,0.11140333,medium,left
at://did:plc:5hqiqrfxaa3we6cyk3neyet3/app.bsky.feed.post/3mmz25pbvn22u,https://bsky.app/profile/wuhanclams.bsky.social/post/3mmz25pbvn22u,wuhanclams.bsky.social,"Climate scientists have been quite clear that we need to stop burning fossil fuels immediately, yet there isn't a country on Earth where you can't burn all the fossil fuels you want, so long as you can afford it.",2026-05-29 12:18:08.566000-05:00,1,0,0,0,opinion,True,True,True,0.013005874,low,left
at://did:plc:tymf6jjpl7xqiorkj5kfkxrk/app.bsky.feed.post/3mmyyipttqs2n,https://bsky.app/profile/joebowd.bsky.social/post/3mmyyipttqs2n,joebowd.bsky.social,"HUMANS USING FOSSIL FUELS CAN DESTROY THIS PLACE.  RENEWABLE ENERGY CAN SAVE IT BUT TRUMP IS INVESTED IN FOSSIL FUELS AND HE WANTS TO OPEN UP NEW AREAS FOR OIL DRILLING. LUCKy FOR US, ENOUGH PEOPLE IN OTHER PLACES AROUND THE WORLD, ARE MOVING AHEAD WITH RENEWABLES.",2026-05-29 11:48:30.775000-05:00,0,0,0,0,opinion,True,True,True,0.040925518,low,left
at://did:plc:rtx6csb6iivbnt2nyr7jfwm4/app.bsky.feed.post/3mmyyhm2bkc2n,https://bsky.app/profile/sonyasteele.bsky.social/post/3mmyyhm2bkc2n,sonyasteele.bsky.social,Steyer has spent over $200 million dollars of his profits from fossil fuels and private prisons to buy every person he can and is now smearing the most experienced democrat instead of the republican. Why? He wants the power. Steyer serves himself. Becerra has always served the people.,2026-05-29 11:47:53.235000-05:00,3,0,0,0,opinion,True,True,True,0.11181668,medium,left
at://did:plc:vao23dmph7uezdt3gzk7nxwm/app.bsky.feed.post/3mmyydr2de22n,https://bsky.app/profile/dfeldman.org/post/3mmyydr2de22n,dfeldman.org,"It’s more about the wasted energy, all of it from fossil fuels here. Also methane released into the atmosphere is a much more potent greenhouse gas than CO2- although some of it did burn up I suppose.",2026-05-29 11:45:44.265000-05:00,1,0,0,0,opinion,True,True,True,0.014890783,low,left
at://did:plc:iwph7lvihzselxoahyepgtnp/app.bsky.feed.post/3mmyy7u7fhk2u,https://bsky.app/profile/nojustdan.bsky.social/post/3mmyy7u7fhk2u,nojustdan.bsky.social,The rest of the world is moving past fossil fuels. Thanks to fossil fuel lobbyists I’m afraid the US will be the last place on earth to change.,2026-05-29 11:43:33.359000-05:00,2,0,0,0,opinion,True,True,True,0.05354243,low,left
at://did:plc:yjqekodgo25hjem4isderwak/app.bsky.feed.post/3mmyy4go7h22q,https://bsky.app/profile/kevinleecaster.bsky.social/post/3mmyy4go7h22q,kevinleecaster.bsky.social,"California, who has one of the highest EV penetration rates in the world, has started to deal with impacts of falling demand for fossil fuels.

It's a very tricky aspect of the energy transition as we're seeing in the elections there next week.",2026-05-29 11:41:38.501000-05:00,0,0,1,0,opinion,True,True,True,0.008544922,low,neutral
at://did:plc:xqgtq6a74y3dir46oy3dm7ev/app.bsky.feed.post/3mmyxue6g6k2y,https://bsky.app/profile/happygranny.bsky.social/post/3mmyxue6g6k2y,happygranny.bsky.social,GOP is doing the best to put us into a dark age and put the US in danger of loosing the renewable energy race.,2026-05-29 11:37:07.451000-05:00,1,0,0,0,opinion,True,True,True,0.10089093,medium,left
at://did:plc:5amgldjhwzn3ns7bvtxobdhk/app.bsky.feed.post/3mmyxc3amhc25,https://bsky.app/profile/elljay649.bsky.social/post/3mmyxc3amhc25,elljay649.bsky.social,I have been hoping and praying that what we are witnessing the death throes of patriarchy and fossil fuels. I am losing that hope more and more by the day.,2026-05-29 11:26:54.105000-05:00,0,0,0,0,opinion,True,True,True,0.11739369,medium,left
at://did:plc:oa6sv5tk56lwrlfultax2ene/app.bsky.feed.post/3mmyx2zs56c2p,https://bsky.app/profile/ggwwrights.bsky.social/post/3mmyx2zs56c2p,ggwwrights.bsky.social,"May 29 - International Day of United Nations Peacekeepers
It's time to pursue Peace instead of war and refit weapons industry to renewable energy. #StopKillingPeople",2026-05-29 11:22:57.701000-05:00,0,0,0,0,opinion,True,True,True,0.16765249,medium,left
at://did:plc:f45rmqrfxsgogceeitwosszx/app.bsky.feed.post/3mmywmmjv2c2q,https://bsky.app/profile/dcrinyyc.bsky.social/post/3mmywmmjv2c2q,dcrinyyc.bsky.social,"by increasing the production of said fossil fuels. The goal is the elimination of this 100+ year old globally harmful practice. 

If you accept the findings of climate science, you need to get comfortable with this reality. No matter where you live.",2026-05-29 11:14:54.034000-05:00,10,0,1,0,opinion,True,True,True,0.017466826,low,left
at://did:plc:yjqekodgo25hjem4isderwak/app.bsky.feed.post/3mmz7rz4eek2q,https://bsky.app/profile/kevinleecaster.bsky.social/post/3mmz7rz4eek2q,kevinleecaster.bsky.social,"I do understand your position on the ""degree"" of climate science denial between those who support the immediate growth of a Carbon Dioxide Removal industry and the economy versus those who oppose doing that. At least they do, I assume we agree that everyone should decarbonize their lives asap.",2026-05-29 13:58:58.675000-05:00,0,0,1,0,opinion,True,True,True,0.020607091,low,neutral
at://did:plc:loso44gbzbpofvs2junrhc66/app.bsky.feed.post/3mmz33u67ms22,https://bsky.app/profile/nicky.wiki/post/3mmz33u67ms22,nicky.wiki,"At the very least it sounds broadly similar to a carbon tax, which functions primarily not to raise revenue but to make carbon a less competitive choice for the buyer",2026-05-29 12:35:00.327000-05:00,1,0,2,0,opinion,True,True,True,0.005686143,low,neutral
at://did:plc:z7sczf52yowa5fn6w35af53u/app.bsky.feed.post/3mmyrsqvfgk2u,https://bsky.app/profile/spacedoutspaceman.bsky.social/post/3mmyrsqvfgk2u,spacedoutspaceman.bsky.social,"No, we know very well how problematic fossil fuels are.

It's going to require advances in science and technology to help resolve those issues 

Climate science would barely exist without the satellites we have in orbit.

You, are indeed the ignorant one here. But you don't have to be. 

Study up.",2026-05-29 09:48:51.226000-05:00,0,0,0,0,opinion,True,True,True,0.52139956,medium,left
at://did:plc:yjqekodgo25hjem4isderwak/app.bsky.feed.post/3mmypxhih2c2q,https://bsky.app/profile/kevinleecaster.bsky.social/post/3mmypxhih2c2q,kevinleecaster.bsky.social,"If you oppose using captured CO2 for enhanced oil recovery, you are a climate science denier and a fossil fool since people are still buying fossil fuels EOR is going to take place.

It's far better to use captured CO2 than it is to extract fossil CO2 from deep underground.",2026-05-29 09:15:41.653000-05:00,0,0,1,0,opinion,True,True,True,0.47886392,medium,left
at://did:plc:hfpkv5nx444vx34nbqqkafnt/app.bsky.feed.post/3mmypgieits2b,https://bsky.app/profile/ronsteenblik.bsky.social/post/3mmypgieits2b,ronsteenblik.bsky.social,I wouldn’t be so absolute. There are many people who are not climate-science deniers who are opposed to particular CDS projects if the CO2 is going to be used for enhanced oil recovery. (I’m not suggesting that’s the reason in this case.),2026-05-29 09:06:12.148000-05:00,0,0,1,0,opinion,True,True,True,0.012314741,low,neutral
at://did:plc:yjqekodgo25hjem4isderwak/app.bsky.feed.post/3mmyovgv4lc2q,https://bsky.app/profile/kevinleecaster.bsky.social/post/3mmyovgv4lc2q,kevinleecaster.bsky.social,Progress in California largely goes unnoticed because the fossil fuel industry has convinced most people to despise California ever since they implemented a carbon tax.,2026-05-29 08:56:40.170000-05:00,0,0,0,0,opinion,True,True,True,0.050573748,low,left
at://did:plc:yjqekodgo25hjem4isderwak/app.bsky.feed.post/3mmyofam3us2q,https://bsky.app/profile/kevinleecaster.bsky.social/post/3mmyofam3us2q,kevinleecaster.bsky.social,"A reminder that only climate science deniers oppose carbon dioxide sequestration.

I despise NIMBYs like these who are willing to let our planet burn rather than helping to protect it.",2026-05-29 08:47:36.712000-05:00,0,0,1,0,opinion,True,True,True,0.23667802,medium,left
at://did:plc:vhxpr7rmohblmq4mg5q3yhga/app.bsky.feed.post/3mmynr62fbc2z,https://bsky.app/profile/themrneutron.bsky.social/post/3mmynr62fbc2z,themrneutron.bsky.social,"The +1.5°C/2°C framing has always been an issue for me...

Those were never safe thresholds, they were negotiated political targets that represented what was deemed achievable, then reframed as safety boundaries. 

The actual climate science never said 1.49°C was safe and 1.51°C was dangerous.",2026-05-29 08:36:22.946000-05:00,5,0,1,0,opinion,True,True,True,0.010429831,low,left
at://did:plc:dcqe6ztd46q6cbzm25fa7aex/app.bsky.feed.post/3mmykt3avm22x,https://bsky.app/profile/mattswift.bsky.social/post/3mmykt3avm22x,mattswift.bsky.social,"Is it a bad thing?
Adam smith was quite clear that taxation should be used to increase the true costs associated with negative externalities so that the market can function correctly. 
An example of this might be a carbon tax. 
The more we simplify over all taxes, the less useful they are for this",2026-05-29 07:43:45.896000-05:00,1,0,1,0,opinion,True,True,True,0.045625936,low,neutral
at://did:plc:xnmkjaouspdzqv4hzvvcf3j3/app.bsky.feed.post/3mmyfbwuwwj2q,https://bsky.app/profile/euobserver.com/post/3mmyfbwuwwj2q,euobserver.com,"Having been shut out of the 'design' of the EU's carbon levy, Africa should hit back with its own carbon tax, says the chief economist at the UN Economic Commission for Africa.",2026-05-29 06:04:42.147000-05:00,1,1,0,0,opinion,True,True,True,0.034513097,low,neutral
at://did:plc:vggunpnicjhemh2thquhcgth/app.bsky.feed.post/3mmyehnmod22x,https://bsky.app/profile/wulliemacdubh.bsky.social/post/3mmyehnmod22x,wulliemacdubh.bsky.social,"Idealogy+Activism—->Zealotry.
Always beware The Zealots. 

They all have “their Truth”, which is unassailable and impervious to little people and infidels. We need them to spark  change but they can’t be given power.

I spent more time explaining the math of carbon tax and the rebate than he did.",2026-05-29 05:50:00.052000-05:00,2,1,0,0,opinion,True,True,True,0.08874765,low,unclear
at://did:plc:ul6257nlxim4rdn7i7ujruy2/app.bsky.feed.post/3mmye23smqc2w,https://bsky.app/profile/kryton3298.bsky.social/post/3mmye23smqc2w,kryton3298.bsky.social,"The administration’s slow erosion of modest heat protections like the National Emphasis Program won’t get the same kind of attention as Trump Cabinet members’ bombastic sound bites about being in a “golden era” of fossil energy, or Trump himself posting nonsense about climate science on social media",2026-05-29 05:42:25.166000-05:00,5,5,0,1,opinion,True,True,True,0.30319387,medium,left
at://did:plc:rvxsw2jtyf5kvoevlj6l22vk/app.bsky.feed.post/3mmyad4gexs2c,https://bsky.app/profile/adaloveslace.bsky.social/post/3mmyad4gexs2c,adaloveslace.bsky.social,The absolutely crazy thing is even most Reform supporters trust climate science but still enjoy bashing experts and concensus.,2026-05-29 04:35:52.835000-05:00,0,0,0,0,opinion,True,True,True,0.19986437,medium,unclear
at://did:plc:bnrbtw6jsib7wknhaet7gvcl/app.bsky.feed.post/3mmy6nhmszc26,https://bsky.app/profile/zom-poc.bsky.social/post/3mmy6nhmszc26,zom-poc.bsky.social,"Science proves human pollution is having a measurable impact on climate.

Science also proves humans had zero impact on the beginning and end of the last ice age.
(Earth just does shit 🤷🏻‍♂️)",2026-05-29 04:05:52.641000-05:00,1,0,1,0,opinion,True,True,True,0.5140397,medium,unclear
at://did:plc:4hcakeaznxxhheyymlm5fyor/app.bsky.feed.post/3mmy3slax5c2y,https://bsky.app/profile/bmhayward.bsky.social/post/3mmy3slax5c2y,bmhayward.bsky.social,"The UK Met office isn’t ‘a’ or ‘some’ scientist, it’s the UK’s authoritative voice on climate & as RNZ states there’s clear evidence that global heating is exacerbating these temperatures 

So how are we regressing in TVNZ climate reporting with equivocal statements? climate science editors matter",2026-05-29 03:15:02.993000-05:00,21,2,2,0,opinion,True,True,True,0.014073989,low,left
at://did:plc:u7hxef7qmcryysno4htqhdcb/app.bsky.feed.post/3mmy35gpun22i,https://bsky.app/profile/scriptorialtd.bsky.social/post/3mmy35gpun22i,scriptorialtd.bsky.social,"Falling #deforestation rates in Brazil and the reduction of global temperature projections: this month’s positive news stories remind us that progress is possible. 🌍 May also marked Sir David Attenborough’s 100th birthday. 🥳

Read more. ⬇️

#StorytellingForChange #Attenborough #GreenGrowth #IPCC",2026-05-29 03:03:13.585000-05:00,1,0,0,0,opinion,True,True,True,0.0072569004,low,left
at://did:plc:2ebzd33hp2r7rws4rl4rizfl/app.bsky.feed.post/3mmy2gdgtak2k,https://bsky.app/profile/weareluigi.bsky.social/post/3mmy2gdgtak2k,weareluigi.bsky.social,"Yeah, turns out the Green New Deal could have made us global leaders in electric cars… but, we burned a few more millions of pounds of coal, and that provided a couple thousand jobs! #Winning",2026-05-29 02:50:18.402000-05:00,3,0,0,0,opinion,True,True,True,0.013382856,low,right
at://did:plc:7oc6pe6qxsppluxr3ehwpg5i/app.bsky.feed.post/3mmxyelfcfr2k,https://bsky.app/profile/mmt-action.bsky.social/post/3mmxyelfcfr2k,mmt-action.bsky.social,"Green New Deal campaigners keep hearing ""we can't afford it."" They're wrong about what can't be afforded. A currency issuer can always buy real resources; labour, materials, energy infrastructure.

#MMT #Economics #PolicyDemand #ClimateAction #GreenNewDeal",2026-05-29 02:13:32.136632-05:00,3,4,0,0,opinion,True,True,True,0.010429831,low,left
at://did:plc:qzszddraggl4m5d2wskzvetl/app.bsky.feed.post/3mmxwnhmhvz2y,https://bsky.app/profile/iami.earth/post/3mmxwnhmhvz2y,iami.earth,That assessment is the gap between knowing and doing. The UK has some of the best climate science in the world and some of the most poorly adapted housing stock. The knowledge exists. The infrastructure does not. The distance between them is not technical. It is political.,2026-05-29 01:42:42-05:00,0,0,0,0,opinion,True,True,True,0.02107848,low,left
at://did:plc:wm5b3q2znvnatujmm46yucon/app.bsky.feed.post/3mmxvjlb4tk23,https://bsky.app/profile/aldunne.eurosky.social/post/3mmxvjlb4tk23,aldunne.eurosky.social,"Thwaites Glacier collapsing, AMOC weakening, ‘Super’ El Niño impending. there should be a Nuremberg for the people who have actively fought back against climate science these last decades",2026-05-29 01:22:38.557000-05:00,5,0,0,0,opinion,True,True,True,0.091913216,low,left
at://did:plc:z77ilmnboc6u2763u4do7w5l/app.bsky.feed.post/3mmxr6mg2jk2k,https://bsky.app/profile/rivasad.bsky.social/post/3mmxr6mg2jk2k,rivasad.bsky.social,The 2015 Paris Agreement was that CO2 emissions would peak before 2025 at the latest and by 2030 would be 43% lower. We are absolutely not moving in the right direction,2026-05-29 00:04:55.703000-05:00,5,0,0,0,opinion,True,True,True,0.007539637,low,left
at://did:plc:fv256ijb3ftgb6hewcujshxw/app.bsky.feed.post/3mmxn77hlp227,https://bsky.app/profile/ubiquity75.xyz/post/3mmxn77hlp227,ubiquity75.xyz,"“When charges of antisemitism are cynically used to suppress free speech, abolish trans healthcare, climate science, gender studies, pediatric cancer treatment and diversity initiatives, Frenk’s failure to put these events in context is a striking abdication of responsibility towards our community.”",2026-05-28 22:53:40.617000-05:00,7,1,1,0,opinion,True,True,True,0.079250954,low,right
at://did:plc:xue5swnq6tayordlqnfretto/app.bsky.feed.post/3mmxlgy5gps2k,https://bsky.app/profile/sarava.net/post/3mmxlgy5gps2k,sarava.net,"I agree that climate science should distance itself from the storylines. Also, I don't think climate sensitivity is built into concentration scenarios, but crude assumptions about carbon cycle are used to convert emissions to concentrations. (Wouldn't it be circular to build in climate sensitivity?)",2026-05-28 22:22:13.987000-05:00,0,0,0,0,opinion,True,True,True,0.023788974,low,neutral
at://did:plc:5nswjcka6ohc27d34u3sy7mv/app.bsky.feed.post/3mmxeouevm22w,https://bsky.app/profile/mrbusinessthecat.bsky.social/post/3mmxeouevm22w,mrbusinessthecat.bsky.social,"Trump’s NC disciples are successfully protecting us from ""woke"" climate science by letting our insurance premiums hit orbit. Who needs a coast when you can just pay $500 more a month for the privilege of watching your house slide into the Atlantic? Truly, a populist victory. #NCPol",2026-05-28 20:21:22.281000-05:00,0,0,0,0,opinion,True,True,True,0.03639866,low,right
