uri,url,author_handle,text,created_at,like_count,repost_count,reply_count,quote_count,news_or_opinion_category,is_political,is_self_contained,is_structurally_complete,toxicity_prob,toxicity_tier,political_stance
at://did:plc:s35z2qcycwi2ogyzogczui7x/app.bsky.feed.post/3mmx5p6mirk2k,https://bsky.app/profile/nogravitasatall.bsky.social/post/3mmx5p6mirk2k,nogravitasatall.bsky.social,"Trump tearing up the JCPOA may turn out to be the most significant single decision to hasten the renewable energy transition .

The Straits of Hormuz will ever be a sword of Damocles over the supply routes. 

More effective than a carbon tax? What a flex. Wonder if he intended that.

/s",2026-05-28 18:16:16.821000-05:00,0,0,0,0,opinion,True,True,True,0.050078966,low,left
at://did:plc:wnhlwfb44kfyi4gb6yc2tvbz/app.bsky.feed.post/3mmx4r3r2xc22,https://bsky.app/profile/ajsdecepida.bsky.social/post/3mmx4r3r2xc22,ajsdecepida.bsky.social,"⚡ The new sea-level study doesn’t point to mystery physics or a vague natural cycle. It points to warmer water, melting glaciers, and shrinking ice sheets — the same bill climate science has been itemizing for years. The budget is closing; the water isn’t stopping. 🌊",2026-05-28 17:59:27.194000-05:00,0,0,1,0,opinion,True,True,True,0.011435116,low,left
at://did:plc:7shrfzwpz4mmnoc73doxithq/app.bsky.feed.post/3mmz7sadqo225,https://bsky.app/profile/mark-dingman.bsky.social/post/3mmz7sadqo225,mark-dingman.bsky.social,"Just a sec: as a private individual you may take a position that might be different from the position you take as PM

I might promote the benefits of 100% clean energy as an individual while as PM acknowledging the reality that middle ground is necessary in the short to medium

Don’t do UK or USA.",2026-05-29 13:59:06.256000-05:00,0,0,0,0,opinion,True,True,True,0.016964182,low,neutral
at://did:plc:46viq7iv5ducp5e5jvsbh6mx/app.bsky.feed.post/3mmz6kklfcs2u,https://bsky.app/profile/daviddoniger.bsky.social/post/3mmz6kklfcs2u,daviddoniger.bsky.social,"“Futility” is just climate denial in a new bottle. 

President Trump recently claimed it’s getting cooler. And EPA Administrator Lee Zeldin told a conference of climate deniers that they should “celebrate vindication” now that he had granted their fondest wish.",2026-05-29 13:36:54.815000-05:00,1,0,1,0,opinion,True,True,True,0.07450261,low,left
at://did:plc:e3adzvtg56lfn3wpdlfjwnoc/app.bsky.feed.post/3mmz67rwlgs2u,https://bsky.app/profile/ecppdx.bsky.social/post/3mmz67rwlgs2u,ecppdx.bsky.social,"I'd argue it's less a ""wedge issue"" like abortion and more like taxing the rich, in that the ""wedge"" is between actual voters and the politicians who supposedly ""represent"" them.",2026-05-29 13:30:53.423000-05:00,0,0,0,0,opinion,True,True,True,0.048099842,low,left
at://did:plc:kz3wodi4q2qkin4hcqfs66kk/app.bsky.feed.post/3mmz5i3rosk2b,https://bsky.app/profile/larubia22.bsky.social/post/3mmz5i3rosk2b,larubia22.bsky.social,"We should have been the leader in championing clean, green energy. We should have led by example with investment and use of clean energy. We should have a planet recovering from dirty gas/oil. But here we are with our “shouldy” lives, led by the backward-ass ‘drill baby drill’ crew.",2026-05-29 13:17:38.443000-05:00,0,0,0,0,opinion,True,True,True,0.43720075,medium,left
at://did:plc:smtwmk5lbhomejy6cc3hqglr/app.bsky.feed.post/3mmz55en2wc2o,https://bsky.app/profile/ol-doc-j-d.bsky.social/post/3mmz55en2wc2o,ol-doc-j-d.bsky.social,"We're always going to argue about abortion. It's a hard choice and it's controversial, and that's why I'm pro-choice, because I want people to make their own choices.

          ~ Hillary Rodham",2026-05-29 13:11:38.627000-05:00,0,0,0,0,opinion,True,True,True,0.09112182,low,left
at://did:plc:6eh7cqwyws7wph3xj7bywthl/app.bsky.feed.post/3mmz54xv4ac2r,https://bsky.app/profile/markgongloff.bsky.social/post/3mmz54xv4ac2r,markgongloff.bsky.social,"What is in China is a ton of clean energy. A ton of coal, too, but the renewables are taking more of the added burden of AI etc",2026-05-29 13:11:25.261000-05:00,0,0,1,0,opinion,True,True,True,0.01847211,low,neutral
at://did:plc:jp2rl3twzm5rpxwa5bbnge6j/app.bsky.feed.post/3mmz4yl7his2u,https://bsky.app/profile/lenaisok.bsky.social/post/3mmz4yl7his2u,lenaisok.bsky.social,"plant more trees in low-income communities to mitigate temperature disparities
grants to distribute and install clean energy (like solar panels)",2026-05-29 13:08:57.751000-05:00,2,0,0,0,opinion,True,True,True,0.0131943645,low,left
at://did:plc:ajunyb5hmvbllgvrqjzi5gy5/app.bsky.feed.post/3mmz4q3yd3c2d,https://bsky.app/profile/opulenceihazit.bsky.social/post/3mmz4q3yd3c2d,opulenceihazit.bsky.social,"""I oppose the death penalty because I am Catholic"" - acceptable, say it louder for the people in the back.

""I oppose abortion because I am Catholic"" - religion has no place in politics, we have separation of church and state for a reason.

This kind of stuff shows up constantly.",2026-05-29 13:04:13.354000-05:00,0,0,0,0,opinion,True,True,True,0.14256015,medium,left
at://did:plc:pd6tfrrlvqbclxvl4a2zy3bk/app.bsky.feed.post/3mmz4p75kr52i,https://bsky.app/profile/freetailed.bsky.social/post/3mmz4p75kr52i,freetailed.bsky.social,"State mandate for 100% clean energy by 2040 and they're scrambling to meet this. Won't get rid of gas, but building out solar and wind. Current MAGA admin is not helping with this. Playing with long duration storage batteries!",2026-05-29 13:03:42.472000-05:00,0,0,1,0,opinion,True,True,True,0.02779579,low,left
at://did:plc:ioy3xvudekzsatjxokajse3m/app.bsky.feed.post/3mmz4lykh6s2v,https://bsky.app/profile/jasonwlewis.bsky.social/post/3mmz4lykh6s2v,jasonwlewis.bsky.social,There is no doubt that the clean energy sector needs to do a better job countering the false claims being made.  The reality is most folks have half formed opinions based on sound bites.  Democrats also need to do a better job as well highlighting the flow of fossil fuel money to Republicans.,2026-05-29 13:01:55.535000-05:00,0,0,0,0,opinion,True,True,True,0.04166769,low,left
at://did:plc:zfty2dfsg3woou74uazhib5t/app.bsky.feed.post/3mmz3z2go5k2r,https://bsky.app/profile/bammax.itch.io/post/3mmz3z2go5k2r,bammax.itch.io,"John McCain saved the Affordable Care Act, but Joe Biden couldn't be bothered to codify abortion rights.",2026-05-29 12:51:19.975000-05:00,1,0,0,0,opinion,True,True,True,0.057005897,low,left
at://did:plc:axpzyhl2p5zy5nmb2vppqvmd/app.bsky.feed.post/3mmz3ygvo5k27,https://bsky.app/profile/oliviamesser.bsky.social/post/3mmz3ygvo5k27,oliviamesser.bsky.social,"y’all have made me so emotional. don’t unfollow just yet -- we’re finishing one last guest essay from two mothers who almost lost their lives, and the lives of their babies, due to Texas’ abortion ban",2026-05-29 12:50:59.495000-05:00,49,8,2,0,opinion,True,True,True,0.10566349,medium,left
at://did:plc:6h32tbiuz6ptigvkkrx2jkrz/app.bsky.feed.post/3mmz3tcnwkk26,https://bsky.app/profile/neeva1.bsky.social/post/3mmz3tcnwkk26,neeva1.bsky.social,"GOP119thCongress, anything?GOPSCOTUS, magaGOP, noncritical thinkers, nonDEMS, Rogan, McConnell, 35% nonvoters, EM,thieves,traitors, misogynoire, greedy2%, anti LGBTQIA+/abortion/POC/women/woke, EpsteinClass, CicadaSteinvoters, rapists, pedos,traffickers, 2016/20/22/24 GOPvoters OWN this!🇺🇸👀😢",2026-05-29 12:48:07.274000-05:00,0,0,0,0,opinion,True,True,True,0.5559701,medium,left
at://did:plc:6h32tbiuz6ptigvkkrx2jkrz/app.bsky.feed.post/3mmz3npetnc26,https://bsky.app/profile/neeva1.bsky.social/post/3mmz3npetnc26,neeva1.bsky.social,"GOP119thCongress, 😳🙄🦇💩GOPSCOTUS, magaGOP, noncritical thinkers, nonDEMS, Rogan, McConnell, 35% nonvoters, EM,thieves,traitors, misogynoire, greedy2%, anti LGBTQIA+/abortion/POC/women/woke, EpsteinClass, CicadaSteinvoters, rapists, pedos,traffickers, 2016/20/22/24 GOPvoters OWN this!🇺🇸👀😢",2026-05-29 12:44:59.281000-05:00,0,0,0,0,opinion,True,True,True,0.6020386,medium,left
at://did:plc:auosi5l2g76gykunujwg3cga/app.bsky.feed.post/3mmz3hdhxqk2n,https://bsky.app/profile/yellowdotstudios.bsky.social/post/3mmz3hdhxqk2n,yellowdotstudios.bsky.social,"Case in point: Even Pew apparently does not understand that ""environmentally friendly"" behaviors should focus on cutting heat trapping pollution, eg: Electrification/switching to clean energy, using less plastic, eating plant-based, and supporting elected leaders who will use laws to cut pollution.",2026-05-29 12:41:25.473000-05:00,3,0,0,0,opinion,True,True,True,0.018849092,low,left
at://did:plc:6h32tbiuz6ptigvkkrx2jkrz/app.bsky.feed.post/3mmz3a522vk26,https://bsky.app/profile/neeva1.bsky.social/post/3mmz3a522vk26,neeva1.bsky.social,"GOP119thCongress, GOPSCOTUS, magaGOP, noncritical thinkers, nonDEMS, Rogan, McConnell, 35% nonvoters, EM,thieves,traitors, misogynoire, greedy2%, anti LGBTQIA+/abortion/POC/women/woke, EpsteinClass, CicadaSteinvoters, rapists, pedos,traffickers, 2016/20/22/24 GOPvoters OWN this!🇺🇸👀😢",2026-05-29 12:37:23.846000-05:00,0,0,0,0,opinion,True,True,True,0.56269526,medium,left
at://did:plc:6h32tbiuz6ptigvkkrx2jkrz/app.bsky.feed.post/3mmz2yalsyk26,https://bsky.app/profile/neeva1.bsky.social/post/3mmz2yalsyk26,neeva1.bsky.social,"GOP119thCongress, stood by & did NOTHING! GOPSCOTUS, magaGOP, noncritical thinkers, nonDEMS, Rogan, McConnell, 35% nonvoters, EM,thieves,traitors, misogynoire, greedy2%, anti LGBTQIA+/abortion/POC/women/woke, EpsteinClass, rapists, pedos,traffickers, 2016/20/22/24 GOPvoters OWN this!🇺🇸👀😢",2026-05-29 12:32:59.138000-05:00,0,0,0,0,opinion,True,True,True,0.52139956,medium,left
at://did:plc:vtmv733c234ewi24w2edzxjd/app.bsky.feed.post/3mmz2vuwgmk2j,https://bsky.app/profile/deepbluetiffany.bsky.social/post/3mmz2vuwgmk2j,deepbluetiffany.bsky.social,"If Jesus was preaching against the laws of Rome, then he was ok with abortion, and divorce, and gay people.",2026-05-29 12:31:39.794000-05:00,0,0,0,0,opinion,True,True,True,0.4269174,medium,unclear
at://did:plc:6zuvtiklilz3ihynwdy52jn6/app.bsky.feed.post/3mmz2rvmals2p,https://bsky.app/profile/reprocaucus.bsky.social/post/3mmz2rvmals2p,reprocaucus.bsky.social,"This fund was never about “protecting” anyone — it was about rewarding anti-abortion extremists who harass providers, intimidate patients, and target health centers. 

While blocked for now, the fight to stop rewarding harmful behavior is far from over.",2026-05-29 12:29:26.292000-05:00,2,0,0,0,opinion,True,True,True,0.10826672,medium,left
at://did:plc:4ypydtsxlmkfyoyoxb26o4wd/app.bsky.feed.post/3mmz2lmwels2f,https://bsky.app/profile/booktweeting.bsky.social/post/3mmz2lmwels2f,booktweeting.bsky.social,"when I see things like this I honestly want to get pregnant and have a spite abortion

fortunately for the patient load of overburdened reproductive clinics, I’m over 60",2026-05-29 12:25:55.859000-05:00,3,0,1,0,opinion,True,True,True,0.29953843,medium,left
at://did:plc:2melr6mzubhzqajoduym7eeq/app.bsky.feed.post/3mmz2f45ap222,https://bsky.app/profile/ackbar7.bsky.social/post/3mmz2f45ap222,ackbar7.bsky.social,Gay marriage and abortion both happened through the courts by unelected judges. The Democratic party has always been to cowardly to lead the way with actual legislation.,2026-05-29 12:22:16.932000-05:00,1,0,1,0,opinion,True,True,True,0.40891263,medium,right
at://did:plc:yxvquynjzxk4eexepivljnts/app.bsky.feed.post/3mmz2bfq4uf2m,https://bsky.app/profile/secularprolife.bsky.social/post/3mmz2bfq4uf2m,secularprolife.bsky.social,"Abortion ideologues argue women's liberation must cost the blood of our children. It's pathetic. We won't do it, and we won't sit quietly while others do it either.",2026-05-29 12:20:12.176799-05:00,0,0,0,0,opinion,True,True,True,0.46982017,medium,right
at://did:plc:fec3u6wzrcgti2k4mrp2hfux/app.bsky.feed.post/3mmz26z3w222w,https://bsky.app/profile/deepkillaryblues.bsky.social/post/3mmz26z3w222w,deepkillaryblues.bsky.social,"Yeah? Who should they associate them with?

Gay marriage and abortion and so forth just happened, I guess. No party involved at all. Obviously both parties are exactly the same, or something. Gee, who knew?",2026-05-29 12:18:52.416000-05:00,0,0,1,0,opinion,True,True,True,0.2922276,medium,unclear
at://did:plc:2melr6mzubhzqajoduym7eeq/app.bsky.feed.post/3mmz225w3s222,https://bsky.app/profile/ackbar7.bsky.social/post/3mmz225w3s222,ackbar7.bsky.social,"With control of the House, Senate and presidency Democrats response to the loss of abortion rights was to do nothing and Harris' plan if she got elected would have taken at least 20 years to restore abortion rights. They are at best indifferent on abortion eights",2026-05-29 12:16:09.697000-05:00,1,0,1,0,opinion,True,True,True,0.06896287,low,right
at://did:plc:dutvbtidkzyzyurmpiq4zbpx/app.bsky.feed.post/3mmyzynoq3s2o,https://bsky.app/profile/cyclefunmontreal.bsky.social/post/3mmyzynoq3s2o,cyclefunmontreal.bsky.social,"The big lie: ""Canada should leverage its oil production capabilities to finance the country’s transition to clean energy.""
To pollute less, we must pollute more, and do it right away, right now.
Explain to me how that works exactly?",2026-05-29 12:15:19.123000-05:00,3,0,1,0,opinion,True,True,True,0.09785384,low,unclear
at://did:plc:2wyta7nppx2mfk7gacwxsqr6/app.bsky.feed.post/3mmz5uotq4c2t,https://bsky.app/profile/akawag213191015.bsky.social/post/3mmz5uotq4c2t,akawag213191015.bsky.social,"#TheMarchToSeelfRowWillBeOverturned tweet
1,486. Roe v. Wade saved women RIP WHPA.
(6-24-22) Roe v Wade RIP WRAA22MTE AG Ken Paxton is an enemy to women's liberty. midwife in Texas has been charged",2026-05-29 13:24:41.085000-05:00,0,0,0,0,opinion,True,True,True,0.11057663,medium,left
at://did:plc:ew3npkvqvbrqbkxbeklaad2b/app.bsky.feed.post/3mmz5jvkgay22,https://bsky.app/profile/weareufd.bsky.social/post/3mmz5jvkgay22,weareufd.bsky.social,"“They are crushing our rights and calling it freedom.”

Melanie Newman of Planned Parenthood called out what the Supreme Court is really doing: taking power from the people and handing it to those already rigging the rules.",2026-05-29 13:18:38.564000-05:00,5,3,0,0,opinion,True,True,True,0.05898502,low,left
at://did:plc:6e2uqumh7x42shb6zhca45ry/app.bsky.feed.post/3mmz4qxzwpk2v,https://bsky.app/profile/mrfox.bsky.social/post/3mmz4qxzwpk2v,mrfox.bsky.social,The small gains made in the first Obama administration were pretty much erased after the 2016 election. The Romney/ACA plan was good on paper but allowing states to opt out of funding pretty much killed it. Roe v Wade is gone because of Obama. What are you talking about,2026-05-29 13:04:42.767000-05:00,1,0,0,0,opinion,True,True,True,0.07371122,low,unclear
at://did:plc:ivd76aneuqrstpbkzoyokkzi/app.bsky.feed.post/3mmz4axdpos2e,https://bsky.app/profile/manzanarez55robin.bsky.social/post/3mmz4axdpos2e,manzanarez55robin.bsky.social,"So called""Pro lifers""could work to stop wars-which cause massive death.
Instead they'll force a child rape victim to carry to term-endangering a child's life.
They call it ""saving babies"" when they vote to make everything in human life a misery,specializing in taking reproductive control away from♀️",2026-05-29 12:55:45.167000-05:00,0,0,0,0,opinion,True,True,True,0.36095104,medium,left
at://did:plc:nreoc6lbmfdgciqb6htdhawl/app.bsky.feed.post/3mmz3e4y3os2v,https://bsky.app/profile/unhandyandy.bsky.social/post/3mmz3e4y3os2v,unhandyandy.bsky.social,"Everyone in public life is constantly required to declare themselves on issues of the day.

Muslims must constantly prove they're good rather bad ones.

Intersectionality is complicated.  Evidently Roma Pride identifies as both pro-LGBT and Leftist.",2026-05-29 12:39:38-05:00,0,0,1,1,opinion,True,True,True,0.27975297,medium,unclear
at://did:plc:5qbf7iuc4ue2tiyhufwyvbp2/app.bsky.feed.post/3mmz2vwv5hc2k,https://bsky.app/profile/tonysflower.bsky.social/post/3mmz2vwv5hc2k,tonysflower.bsky.social,I can’t comprehend how people claim to be pro-life while actively trying to pass laws that can result in the death of women,2026-05-29 12:31:41.850000-05:00,0,0,0,0,opinion,True,True,True,0.19870108,medium,left
at://did:plc:uopituhzgetwgfpnkpe7fiku/app.bsky.feed.post/3mmz2cgkquc2w,https://bsky.app/profile/shelbyleigh.bsky.social/post/3mmz2cgkquc2w,shelbyleigh.bsky.social,I used to write on the pro life posters that hung in my Catholic high school the correct facts since they loved to misinform 💀 can’t gaslight me I know the stages of a fetus,2026-05-29 12:20:47.198000-05:00,0,0,0,0,opinion,True,True,True,0.3048984,medium,right
at://did:plc:hdsuno4mbeea7c6vyipevt2r/app.bsky.feed.post/3mmz23umnek2g,https://bsky.app/profile/soulection.bsky.social/post/3mmz23umnek2g,soulection.bsky.social,"The same pro-life christian extremists that shout about the fetuses that deserve a chance to live are the same ones who vote against the benefits that would actually help keep those babies alive after birth.

The very same ones.

Fuck y'all, suck a dick.",2026-05-29 12:17:07.058000-05:00,0,0,0,0,opinion,True,True,True,0.91625386,high,left
at://did:plc:gsk4ru2wtc6hxcrqv4mr26fj/app.bsky.feed.post/3mmyzkkeaw22w,https://bsky.app/profile/bengaltig3r.bsky.social/post/3mmyzkkeaw22w,bengaltig3r.bsky.social,"Remember y’all…Republicans force women, even arrest them, for any abortion related medical interventions because they are the “PRO-LIFE” party.  They are currently pushing a “Fetal Personhood”, which are Rights of the unborn fetus AND possibly embryos too!!!

Free books for kids? Nah…fuck kids 🖕🏻",2026-05-29 12:07:25.872000-05:00,0,0,0,0,opinion,True,True,True,0.7510937,high,left
at://did:plc:isvv7wuteqfpss7zei7zy7a6/app.bsky.feed.post/3mmyybfwv722s,https://bsky.app/profile/thinkgooder.bsky.social/post/3mmyybfwv722s,thinkgooder.bsky.social,"As a true American, I sincerely support your RIGHT to vote as you wish. 

Willful ignorance? 
That is a choice. 

 BeIng utterly useless? 
That is a choice. 

I am pro choice. Good luck.",2026-05-29 11:44:25.509000-05:00,1,0,0,0,opinion,True,True,True,0.37751234,medium,unclear
at://did:plc:wjkj5bmui5kuzsfrxgtq43g5/app.bsky.feed.post/3mmyy3olgfs2g,https://bsky.app/profile/olddirtymac.bsky.social/post/3mmyy3olgfs2g,olddirtymac.bsky.social,"How is it that 73 million voters were stupid enough to think that the party that raped and murdered, children bombed schools, full of children, beat up, tortured and imprisoned immigrants for no reason somehow the pro-life party.
Not one single Republican deserves any help or respect.",2026-05-29 11:41:13.243000-05:00,0,0,0,0,opinion,True,True,True,0.6989911,medium,left
at://did:plc:isvv7wuteqfpss7zei7zy7a6/app.bsky.feed.post/3mmyy2lzkpk2s,https://bsky.app/profile/thinkgooder.bsky.social/post/3mmyy2lzkpk2s,thinkgooder.bsky.social,"As a true American, I fully support your RIGHT to be useless and uninformed.

Willful nignorance 
is a choice. 

 BeIng utterly useless 
is a choice. 

I am pro choice.",2026-05-29 11:40:37.007000-05:00,0,0,2,0,opinion,True,True,True,0.50503236,medium,unclear
at://did:plc:xgkx5ptpt2crlmtlzr4mjivh/app.bsky.feed.post/3mmyxhzlnk22a,https://bsky.app/profile/sharpeslass.bsky.social/post/3mmyxhzlnk22a,sharpeslass.bsky.social,Add the reinstatement and enforcement of laws restricting corporate monopolies; create universal healthcare; tax the rich; free the ice detainees; strengthen the EPA; back The Ukraine; bring back reproductive rights; create Supreme Court term limits; and RELEASE THE EPSTEIN FILES and prosecute.,2026-05-29 11:30:13.697000-05:00,3,1,1,0,opinion,True,True,True,0.050326355,low,left
at://did:plc:qs37yyyoiic4ufqzywslcrh4/app.bsky.feed.post/3mmyx3jhf7k2q,https://bsky.app/profile/atlcanuck.bsky.social/post/3mmyx3jhf7k2q,atlcanuck.bsky.social,"Considering this, the political alignment of so much of the ""pro life"" crowd might be amusing, if it weren't so tragic. The willful ignorance of it elects people who deny reality in so many ways, but this particular way is increasingly clear to everyone.

Many have died. Many more will die.",2026-05-29 11:23:14.126000-05:00,0,0,0,0,opinion,True,True,True,0.2922276,medium,left
at://did:plc:5yqijy7xxlw6ekucc35njyke/app.bsky.feed.post/3mmywctru7k2j,https://bsky.app/profile/mindyourownuterus.bsky.social/post/3mmywctru7k2j,mindyourownuterus.bsky.social,"Yeah, I’ve been driving around Oklahoma since the election with various versions of Anti-Trump etc on my car. Before that it was Pro-Choice stuff. It’ll happen sooner or later but I can’t let that fear stop me from speaking up. Fuck these MAGA assholes. They don’t scare me.",2026-05-29 11:09:26.094000-05:00,0,0,0,0,opinion,True,True,True,0.78855824,high,left
at://did:plc:e4hhpvt2ozbklfcqcc7pce6o/app.bsky.feed.post/3mmyvm66erk2r,https://bsky.app/profile/emily1collins.bsky.social/post/3mmyvm66erk2r,emily1collins.bsky.social,"Patriarchy is the most successful reproductive rights movement the world has ever known. It found a way to correct the biggest, most intractable injustice of all: female reproductive biology being allocated to those lesser beings, the females.",2026-05-29 10:56:45.239000-05:00,1,0,1,0,opinion,True,True,True,0.28087774,medium,unclear
at://did:plc:3c32rkdtncyshht5xnrt23zj/app.bsky.feed.post/3mmyv3lfyrk27,https://bsky.app/profile/janet-40.bsky.social/post/3mmyv3lfyrk27,janet-40.bsky.social,"Baby raping SHOULD have been enough to end TrumpStein! That’s how SICK today’s MAGA REPUBLIKKKANS are! NO MORALS, NO VALUES, absolutely NOT Pro-Life!",2026-05-29 10:47:28.695000-05:00,0,0,1,0,opinion,True,True,True,0.60152835,medium,left
at://did:plc:paejvikjv5occibgxbge2kii/app.bsky.feed.post/3mmytwpywvs2d,https://bsky.app/profile/alegriaboulangere.bsky.social/post/3mmytwpywvs2d,alegriaboulangere.bsky.social,"WHILE AT THE SAME TIME TRUMP IS DECLARING WE HAVE MORE IMPORTANT THINGS TO SPEND OUR MONEY ON. WE CAN'T AFFORD CHILD CARE SO PARENTS WHO HAVE TO WORK, CAN ACTUALLY GO TO WORK AND WE DEFINITELY CAN'T AFFORD SCHOOL LUNCHES OR SNAP BENIFITS FOR STARVING CHILDREN. DID I MENTION THEY WERE PRO LIFE?",2026-05-29 10:26:51.985000-05:00,0,0,0,0,opinion,True,True,True,0.08637348,low,left
at://did:plc:paejvikjv5occibgxbge2kii/app.bsky.feed.post/3mmytwpyn5c2d,https://bsky.app/profile/alegriaboulangere.bsky.social/post/3mmytwpyn5c2d,alegriaboulangere.bsky.social,"TRUMP AND THE GOP, THE PARTY OF FAMILY VALUES AND PRO LIFE ARE NOW TELLING US IT IS OK FOR TRUMP TO STEAL $1.776 BILLION  FROM OUR TREASURY (TAX DOLLARS) TO PAY CRIMINALS WHO WERE FOUND GUILTY AND THEN PARDONED BY TRUMP BECAUSE THEY DID HIS SEDITIONIST BUSINESS OF TRYING TO OVERTHROW OUR GOERNMENT.",2026-05-29 10:26:51.984000-05:00,0,0,1,0,opinion,True,True,True,0.2648175,medium,left
at://did:plc:a522viaokkdmy4bq3uxhiyry/app.bsky.feed.post/3mmyrlfwfz22m,https://bsky.app/profile/thenativeangel.bsky.social/post/3mmyrlfwfz22m,thenativeangel.bsky.social,"The entire ""pro-life"" philosophy reveals itself in the ease with which they consign a ""baby"" to someone who never intended to make one. Babies need very specific, skilled care from responsible people. They are not a surprise to be left in someone's mailbox during the night.",2026-05-29 09:44:44.845000-05:00,0,0,1,0,opinion,True,True,True,0.032863233,low,left
at://did:plc:ptvepzw6aoqfknexjbn7v2el/app.bsky.feed.post/3mmyquxkiq32x,https://bsky.app/profile/thepowerbroker.bsky.social/post/3mmyquxkiq32x,thepowerbroker.bsky.social,The argument here is about what Democrats do and support. Reproductive rights were literally the law of the land and then voters gave Republicans a SC majority to strip it. In response Democrats protected reproductive rights literally everywhere they had power and ran a huge campaign on it.,2026-05-29 09:32:11.577000-05:00,0,0,1,0,opinion,True,True,True,0.03734144,low,left
at://did:plc:kxyfllssuk6fvy35d5c6m6uk/app.bsky.feed.post/3mmyqos4yl22g,https://bsky.app/profile/artisanrox.bsky.social/post/3mmyqos4yl22g,artisanrox.bsky.social,"Catholic churches are inherently political, too, but use the angle of BABIES and PRO LIFE and FAMILY and are basically misogyny machines.

which is why we should

TAX!

THOSE!

CHURCHES!   *wiggles pom-poms*",2026-05-29 09:28:44.565000-05:00,0,0,0,0,opinion,True,True,True,0.40614098,medium,left
at://did:plc:fvrapn7w2ftb5677mg2sls4o/app.bsky.feed.post/3mmyqbti6z223,https://bsky.app/profile/xeno-t.bsky.social/post/3mmyqbti6z223,xeno-t.bsky.social,"You want me to support the Democrats who voted with MAGA to block the impeachment of the orange fascist 

You are pro-fascist 

Rethink your life man",2026-05-29 09:21:29.773000-05:00,0,0,0,1,opinion,True,True,True,0.4850187,medium,unclear
at://did:plc:zjklcfgk2spfrkeubi22rzan/app.bsky.feed.post/3mmypx6o7sc22,https://bsky.app/profile/sturgeonmouth.bsky.social/post/3mmypx6o7sc22,sturgeonmouth.bsky.social,"Always worth posting in every Mark Cuban thread:

""But I like Chris Christie and Nikki Haley. And honestly, if either one of them was pro choice, I’d probably actively support them."" - Mark Cuban",2026-05-29 09:15:32.404000-05:00,6,0,2,0,opinion,True,True,True,0.017466826,low,unclear
at://did:plc:hbwijwmg4sr4zma6pr6soxov/app.bsky.feed.post/3mmypuld63s22,https://bsky.app/profile/daverubric.bsky.social/post/3mmypuld63s22,daverubric.bsky.social,"I've been chewing on how trans athletes for whom their sport is a way of life, who likely benefit from all the things being in an organized sport offers that are not about competition, and who will probably never go ""pro,"" are expected to just quit if they transition",2026-05-29 09:14:05.010000-05:00,6,0,0,0,opinion,True,True,True,0.20705862,medium,unclear
